{
  "schemaVersion": "1.0",
  "canvas": {
    "width": 438,
    "height": 438,
    "shape": "CIRCLE",
    "centerX": 219,
    "centerY": 219
  },
  "normalization": {
    "inputType": "SCREENSHOT",
    "rotationDegrees": 0.0,
    "confidence": 0.98,
    "requiresPerspectiveCorrection": false,
    "sourceSize": [
      438,
      438
    ]
  },
  "background": {
    "type": "SOLID",
    "color": "#000000"
  },
  "preview": {
    "time": "10:08",
    "date": "08.20",
    "weekday": "THU",
    "battery": 82,
    "steps": 5240,
    "heartRate": 68
  },
  "elements": [
    {
      "id": "time_primary",
      "type": "TIME",
      "dynamic": true,
      "bbox": {
        "x": 111,
        "y": 140,
        "width": 222,
        "height": 82
      },
      "format": "HH:mm",
      "style": {
        "fontFamily": "Pretendard",
        "fontWeight": 400,
        "fontSize": 82,
        "letterSpacing": 0,
        "alignment": "center",
        "color": "#FFFFFF"
      },
      "confidence": 0.86,
      "relationships": {
        "centeredToCanvas": true,
        "group": "primary_time_cluster"
      },
      "rotation": 0
    },
    {
      "id": "date_secondary",
      "type": "DATE",
      "dynamic": true,
      "bbox": {
        "x": 192,
        "y": 267,
        "width": 52,
        "height": 16
      },
      "format": "MM.dd",
      "style": {
        "fontFamily": "Pretendard",
        "fontWeight": 400,
        "fontSize": 21,
        "color": "#FFFFFF",
        "alignment": "center"
      },
      "confidence": 0.52,
      "relationships": {
        "centeredToCanvas": true,
        "alignedWith": [
          "time_primary"
        ],
        "group": "primary_time_cluster"
      },
      "uncertainty": [
        "Could be date or another short numeric field"
      ],
      "rotation": 0
    },
    {
      "id": "weekday_secondary",
      "type": "WEEKDAY",
      "dynamic": true,
      "bbox": {
        "x": 202,
        "y": 302,
        "width": 32,
        "height": 12
      },
      "format": "EEE",
      "style": {
        "fontFamily": "Pretendard",
        "fontWeight": 400,
        "fontSize": 16,
        "color": "#FFFFFF",
        "alignment": "center"
      },
      "confidence": 0.52,
      "relationships": {
        "centeredToCanvas": true,
        "alignedWith": [
          "time_primary"
        ],
        "group": "primary_time_cluster"
      },
      "uncertainty": [
        "Could be weekday or another short label"
      ],
      "rotation": 0
    }
  ],
  "analysis": {
    "watchFaceCategory": "MINIMAL_DIGITAL",
    "overallConfidence": 0.63,
    "requiresStaticAssetExtraction": false,
    "requiresHumanReview": true,
    "method": "dominant-corner-background + connected-components + horizontal-band heuristic",
    "componentCount": 14,
    "groupCount": 5
  }
}
