{
  "schemaVersion": "1.0",
  "canvas": {
    "width": 438,
    "height": 438,
    "shape": "CIRCLE",
    "centerX": 219,
    "centerY": 219
  },
  "normalization": {
    "inputType": "SCREENSHOT",
    "rotationDegrees": 0.0,
    "confidence": 1.0,
    "requiresPerspectiveCorrection": false,
    "sourceSize": [
      438,
      438
    ]
  },
  "background": {
    "type": "SOLID",
    "color": "#000000"
  },
  "preview": {
    "time": "10:08",
    "date": "08.20",
    "weekday": "THU",
    "battery": 82,
    "steps": 5240,
    "heartRate": 68
  },
  "elements": [
    {
      "id": "time_primary",
      "type": "TIME",
      "dynamic": true,
      "bbox": {
        "x": 80,
        "y": 140,
        "width": 278,
        "height": 100
      },
      "format": "HH:mm",
      "style": {
        "fontFamily": "Pretendard",
        "fontWeight": 400,
        "fontSize": 92,
        "letterSpacing": 0,
        "alignment": "center",
        "color": "#FFFFFF"
      },
      "confidence": 1.0,
      "relationships": {
        "centeredToCanvas": true,
        "group": "primary_time_cluster"
      }
    },
    {
      "id": "date_secondary",
      "type": "DATE",
      "dynamic": true,
      "bbox": {
        "x": 160,
        "y": 255,
        "width": 118,
        "height": 32
      },
      "format": "MM.dd",
      "style": {
        "fontFamily": "Pretendard",
        "fontWeight": 400,
        "fontSize": 22,
        "color": "#9EA4AD",
        "alignment": "center"
      },
      "confidence": 1.0,
      "relationships": {
        "centeredToCanvas": true,
        "alignedWith": [
          "time_primary"
        ],
        "group": "primary_time_cluster"
      }
    }
  ],
  "analysis": {
    "watchFaceCategory": "MINIMAL_DIGITAL",
    "overallConfidence": 1.0,
    "requiresStaticAssetExtraction": false,
    "requiresHumanReview": false,
    "method": "fixed canonical sample scene"
  }
}
