{
  "schemaVersion": "1.0",
  "canvas": {
    "width": 438,
    "height": 438,
    "shape": "CIRCLE",
    "centerX": 219,
    "centerY": 219
  },
  "normalization": {
    "inputType": "PHOTOGRAPH",
    "rotationDegrees": 0.0,
    "confidence": 0.78,
    "requiresPerspectiveCorrection": false,
    "sourceSize": [
      1000,
      1000
    ],
    "displayBounds": {
      "x": 362,
      "y": 308,
      "width": 352,
      "height": 378
    }
  },
  "background": {
    "type": "SOLID",
    "color": "#000000"
  },
  "preview": {
    "time": "10:08:30",
    "date": "08.20",
    "weekday": "THU",
    "battery": 82,
    "steps": 5240,
    "heartRate": 68
  },
  "clock": {
    "type": "ANALOG",
    "centerX": 219,
    "centerY": 219,
    "confidence": 0.97,
    "method": "A1a fixed pivot from normalized display"
  },
  "elements": [
    {
      "id": "dial_clean",
      "type": "STATIC_IMAGE",
      "dynamic": false,
      "bbox": {
        "x": 0,
        "y": 0,
        "width": 438,
        "height": 438
      },
      "asset": "assets/dial_clean.png",
      "assetInstruction": {
        "operation": "extract_from_reference"
      },
      "confidence": 0.68,
      "zIndex": 0,
      "uncertainty": [
        "A1a uses a conservative geometric hand mask; automatic segmentation is deferred to A1b"
      ]
    },
    {
      "id": "hour_hand",
      "type": "ANALOG_HAND",
      "role": "HOUR",
      "dynamic": true,
      "bbox": {
        "x": 207,
        "y": 142,
        "width": 24,
        "height": 89
      },
      "asset": "assets/hour_hand.png",
      "observedAngleDeg": 306.0,
      "length": 77.0,
      "thickness": 8.0,
      "pivotX": 0.5,
      "pivotY": 0.865169,
      "confidence": 0.61,
      "zIndex": 10,
      "uncertainty": [
        "Hand geometry is manually adjustable in A1a",
        "Observed angle is from the supplied product photograph"
      ]
    },
    {
      "id": "minute_hand",
      "type": "ANALOG_HAND",
      "role": "MINUTE",
      "dynamic": true,
      "bbox": {
        "x": 209,
        "y": 77,
        "width": 20,
        "height": 152
      },
      "asset": "assets/minute_hand.png",
      "observedAngleDeg": 54.0,
      "length": 142.0,
      "thickness": 8.0,
      "pivotX": 0.5,
      "pivotY": 0.934211,
      "confidence": 0.61,
      "zIndex": 20,
      "uncertainty": [
        "Hand geometry is manually adjustable in A1a",
        "Observed angle is from the supplied product photograph"
      ]
    },
    {
      "id": "second_hand",
      "type": "ANALOG_HAND",
      "role": "SECOND",
      "dynamic": true,
      "bbox": {
        "x": 215,
        "y": 41,
        "width": 8,
        "height": 187
      },
      "asset": "assets/second_hand.png",
      "observedAngleDeg": 180.0,
      "length": 178.0,
      "thickness": 3.0,
      "pivotX": 0.5,
      "pivotY": 0.951872,
      "confidence": 0.74,
      "zIndex": 30,
      "uncertainty": [
        "Hand geometry is manually adjustable in A1a",
        "Observed angle is from the supplied product photograph"
      ],
      "sweepFrequency": 15
    },
    {
      "id": "center_cap",
      "type": "STATIC_IMAGE",
      "dynamic": false,
      "bbox": {
        "x": 207,
        "y": 207,
        "width": 24,
        "height": 24
      },
      "asset": "assets/center_cap.png",
      "assetInstruction": {
        "operation": "extract_from_reference"
      },
      "confidence": 0.72,
      "zIndex": 100,
      "uncertainty": [
        "Center cap is preserved as a static foreground layer"
      ]
    }
  ],
  "analysis": {
    "watchFaceCategory": "MINIMAL_ANALOG",
    "overallConfidence": 0.68,
    "requiresStaticAssetExtraction": true,
    "requiresHumanReview": true,
    "method": "A1a dark-display crop + explicit clock pivot + adjustable hand assets",
    "componentCount": 1,
    "groupCount": 4
  }
}
